{
  "bbox_format": "cxcywh_norm",
  "counts": {
    "dataset_images_total": 10,
    "detections": 12,
    "detections_excluded": 0,
    "detections_input": 12,
    "images": 2,
    "prediction_images_evaluated": 2,
    "prediction_images_excluded": 0,
    "prediction_images_total": 2,
    "selected_images_without_predictions": 0
  },
  "dataset": "data/smoke",
  "dry_run": false,
  "max_images": 2,
  "metrics": {
    "ar100": 0.8104166666666668,
    "map50": 0.9381188118811881,
    "map50_95": 0.8111386138613862,
    "map75": 0.9381188118811881
  },
  "normalization": {
    "assume_class_id_is_category_id": false,
    "classes": null
  },
  "ok": true,
  "predictions": "reports/labeled_sample_compatibility_2026-09-10/runtime-parity-v4.8/predictions_torchscript.json",
  "protocol": null,
  "protocol_id": null,
  "report_schema_version": 1,
  "split": "val",
  "split_requested": "val",
  "stats": [
    0.8111386138613862,
    0.9381188118811881,
    0.9381188118811881,
    -1.0,
    0.7138613861386138,
    0.8887788778877888,
    0.46875,
    0.8104166666666668,
    0.8104166666666668,
    -1.0,
    0.7125,
    0.888888888888889
  ],
  "status": "ok",
  "timestamp": "2026-09-10T23:05:32Z",
  "validation": {
    "mode": "strict",
    "repair_enabled": false
  },
  "warnings": []
}
